{
    "version":  1,
    "relay_version":  "1.0.0",
    "request_id":  "relay-smoke-20260908-0223",
    "operation":  null,
    "status":  "failed",
    "started_at":  "2026-09-08T02:35:53.9607854+00:00",
    "completed_at":  "2026-09-08T02:35:53.9642289+00:00",
    "error":  "A parameter cannot be found that matches parameter name \u0027Depth\u0027.",
    "artifacts":  [

                  ]
}
