{
    "version":  1,
    "relay_version":  "1.1.2",
    "request_id":  "relay-body-audit-20260908-0248",
    "operation":  "scene_audit_v1",
    "status":  "success",
    "started_at":  "2026-09-08T02:50:26.4199045+00:00",
    "completed_at":  "2026-09-08T02:50:26.5969390+00:00",
    "blender":  {
                    "status":  "success",
                    "result":  {
                                   "executed":  true,
                                   "result":  "SELFIMAGE_BLENDER_SCENE_AUDIT_V1::{\"active_object\": \"GEO-body_female_realistic\", \"blender_version\": [5, 2, 1], \"blender_version_string\": \"5.2.1 LTS\", \"camera\": null, \"nonclaims\": [\"No source-file hash verified by this scene-only script\", \"No object or scene mutation performed\", \"No morphology acceptance or Stage-A promotion\"], \"object_count\": 3, \"objects\": [{\"hide_render\": false, \"hide_viewport\": false, \"mesh\": {\"boundary_edges\": 0, \"data_name\": \"GEO-body_female_realistic\", \"dimensions\": [0.8422614336013794, 0.28393885493278503, 1.639373779296875], \"edges\": 127020, \"hide_render\": false, \"hide_viewport\": false, \"location\": [0.0, 0.0, 0.0], \"loops\": 254040, \"materials\": [], \"modifiers\": [], \"name\": \"GEO-body_female_realistic\", \"nonmanifold_edges\": 0, \"polygons\": 84680, \"rotation_euler\": [0.0, 0.0, 0.0], \"scale\": [1.0, 1.0, 1.0], \"uv_layers\": [], \"vertex_groups\": [], \"vertices\": 42342, \"wire_edges\": 0}, \"name\": \"GEO-body_female_realistic\", \"selected\": true, \"type\": \"MESH\"}, {\"hide_render\": false, \"hide_viewport\": false, \"mesh\": {\"boundary_edges\": 2176, \"data_name\": \"GEO-body_female_realistic.eye.L\", \"dimensions\": [0.023998109623789787, 0.02389596402645111, 0.024022473022341728], \"edges\": 2720, \"hide_render\": false, \"hide_viewport\": false, \"location\": [0.03288137912750244, -0.1216067522764206, 1.5344409942626953], \"loops\": 3264, \"materials\": [], \"modifiers\": [], \"name\": \"GEO-body_female_realistic.eye.L\", \"nonmanifold_edges\": 2176, \"polygons\": 1088, \"rotation_euler\": [0.0, 0.0, 0.0], \"scale\": [0.8616507053375244, 0.8616507053375244, 0.8616507053375244], \"uv_layers\": [], \"vertex_groups\": [], \"vertices\": 2176, \"wire_edges\": 0}, \"name\": \"GEO-body_female_realistic.eye.L\", \"selected\": true, \"type\": \"MESH\"}, {\"hide_render\": false, \"hide_viewport\": false, \"mesh\": {\"boundary_edges\": 2176, \"data_name\": \"GEO-body_female_realistic.eye.R\", \"dimensions\": [0.02400452457368374, 0.023917371407151222, 0.02402246929705143], \"edges\": 2720, \"hide_render\": false, \"hide_viewport\": false, \"location\": [-0.03282523155212402, -0.12019778788089752, 1.5344384908676147], \"loops\": 3264, \"materials\": [], \"modifiers\": [], \"name\": \"GEO-body_female_realistic.eye.R\", \"nonmanifold_edges\": 2176, \"polygons\": 1088, \"rotation_euler\": [0.0, 0.0, 0.0], \"scale\": [0.8616505861282349, 0.8616505861282349, 0.8616505861282349], \"uv_layers\": [], \"vertex_groups\": [], \"vertices\": 2176, \"wire_edges\": 0}, \"name\": \"GEO-body_female_realistic.eye.R\", \"selected\": true, \"type\": \"MESH\"}], \"render_engine\": \"BLENDER_EEVEE\", \"scene\": \"Scene\", \"schema\": \"SELFIMAGE_BLENDER_SCENE_AUDIT_V1\", \"selected_cc0_body_check\": {\"actual_polygons\": 84680, \"actual_vertices\": 42342, \"expected_triangles_on_selected_mirror_transport\": 84680, \"expected_vertices_on_selected_mirror_transport\": 42342, \"object_name\": \"GEO-body_female_realistic\", \"polygon_count_matches_selected_transport\": true, \"present\": true, \"uv_layer_count\": 0, \"vertex_count_matches_selected_transport\": true}, \"status\": \"READ_ONLY_SCENE_AUDIT\"}\n"
                               }
                },
    "artifacts":  [

                  ]
}
