{
    "version":  1,
    "relay_version":  "1.1.1",
    "request_id":  "relay-smoke-20260908-0238",
    "operation":  "ping",
    "status":  "success",
    "started_at":  "2026-09-08T02:37:44.9606707+00:00",
    "completed_at":  "2026-09-08T02:37:45.0471514+00:00",
    "blender":  {
                    "status":  "success",
                    "result":  {
                                   "pong":  true
                               }
                },
    "artifacts":  [

                  ]
}
