{
    "version":  1,
    "relay_version":  "1.1.2",
    "request_id":  "relay-body-viewport-20260908-0248",
    "operation":  "viewport_capture",
    "status":  "success",
    "started_at":  "2026-09-08T02:50:26.7255631+00:00",
    "completed_at":  "2026-09-08T02:50:26.8886556+00:00",
    "blender":  {
                    "status":  "success",
                    "result":  {
                                   "success":  true,
                                   "width":  783,
                                   "height":  880,
                                   "filepath":  "C:\\Users\\patri\\vera-blender-runner\\_work\\_temp\\vera-blender-relay-artifacts\\relay-body-viewport-20260908-0248\\viewport-relay-body-viewport-20260908-0248.png",
                                   "method":  "offscreen"
                               }
                },
    "artifacts":  [
                      {
                          "name":  "viewport-relay-body-viewport-20260908-0248.png",
                          "bytes":  256947,
                          "sha256":  "652e344468185b80853ce0672d1e698b40c560c78796134cf95abcc24500dd93"
                      }
                  ]
}
