{
    "version":  1,
    "relay_version":  "1.1.1",
    "request_id":  "relay-scene-20260908-0240",
    "operation":  "scene_info",
    "status":  "success",
    "started_at":  "2026-09-08T02:40:35.1171826+00:00",
    "completed_at":  "2026-09-08T02:40:35.1408898+00:00",
    "blender":  {
                    "status":  "success",
                    "result":  {
                                   "name":  "Scene",
                                   "object_count":  3,
                                   "objects":  [
                                                   {
                                                       "name":  "Cube",
                                                       "type":  "MESH",
                                                       "location":  [
                                                                        0.0,
                                                                        0.0,
                                                                        0.0
                                                                    ]
                                                   },
                                                   {
                                                       "name":  "Light",
                                                       "type":  "LIGHT",
                                                       "location":  [
                                                                        4.08,
                                                                        1.01,
                                                                        5.9
                                                                    ]
                                                   },
                                                   {
                                                       "name":  "Camera",
                                                       "type":  "CAMERA",
                                                       "location":  [
                                                                        7.36,
                                                                        -6.93,
                                                                        4.96
                                                                    ]
                                                   }
                                               ],
                                   "materials_count":  2
                               }
                },
    "artifacts":  [

                  ]
}
