{
    "version":  1,
    "relay_version":  "1.1.1",
    "request_id":  "relay-addon-20260908-0240",
    "operation":  "addon_info",
    "status":  "success",
    "started_at":  "2026-09-08T02:40:34.8762807+00:00",
    "completed_at":  "2026-09-08T02:40:34.9960884+00:00",
    "blender":  {
                    "status":  "success",
                    "result":  {
                                   "name":  "MCP for Blender",
                                   "addon_version":  [
                                                         1,
                                                         6
                                                     ],
                                   "protocol_version":  5,
                                   "capabilities":  [
                                                        "drain_human_activity",
                                                        "execute_code",
                                                        "get_addon_info",
                                                        "get_object_info",
                                                        "get_scene_info",
                                                        "get_telemetry_consent",
                                                        "get_viewport_screenshot",
                                                        "get_world_state_snapshot",
                                                        "set_telemetry_consent"
                                                    ],
                                   "blender_version":  "5.2.1 LTS"
                               }
                },
    "artifacts":  [

                  ]
}
